[
  {
    "id": "TASK-01",
    "title": "Strapi task title",
    "description": "Business value and the bounded Strapi change.",
    "status": "pending",
    "priority": "high",
    "dependencies": [],
    "assignedSquad": {
      "orchestrator": "project-manager",
      "analyst": "cms-business-analyst",
      "architect": "strapi-solution-architect",
      "developers": ["strapi-backend-engineer"],
      "reviewers": ["qa-tester", "security-reviewer"]
    },
    "dorMet": false,
    "dodMet": false,
    "rejectionCount": 0,
    "reviewNotes": [],
    "artifacts": {
      "userStory": "",
      "acceptanceCriteria": [],
      "contentModelChanges": [],
      "apiContracts": [],
      "permissionMatrix": [],
      "migrationPlan": "",
      "dataClassification": [],
      "pluginImpacts": [],
      "testsWritten": [],
      "securityEvidence": [],
      "rolloutPlan": "",
      "rollbackPlan": "",
      "toolAuditResults": {
        "typecheck": "skip",
        "lint": "skip",
        "testgen": "skip",
        "unit": "skip",
        "integration": "skip",
        "security": "skip"
      },
      "suppressions": []
    }
  }
]
